企業名,勤務地,給与,初年度年収
株式会社クレディセゾン ,＜本社・テクノロジーセンター＞ 東京都豊島区東池袋3-1-1 サンシャイン60内 ※以下にて勤務の…,"月給33万5,000円〜 ※経験・スキルに応じて決定いたします。",600万円～1000万円
三井不動産レジデンシャル株式会社 ,本社および全国の支店・営業所、 その他国内外の事務所にて募集。 本社 (東京・日本橋) 支店 (札…,"月給245,000円以上 ※新卒(大卒)入社時基本給 ※年齢・ご経験等を考慮し決定いたします",初年度年収のデータなし
日東金属工業株式会社 ,【八潮工場／マイカー通勤OK！】 埼玉県八潮市二丁目358 ＜電車でのアクセス＞ 1.東武スカイツ…,月給22万円〜45万円＋賞与年2回（2019年実績：6.5ヶ月） ※経験・年齢・能力を考慮のうえ、決定致します…,400万円～700万円
とら婚株式会社 ,【秋葉原オフィス】 〒101-0021 東京都千代田区外神田4-7-3 秋葉原虎ビル8階・9階,年俸制800万円〜 ※経験、スキルなどを考慮した上、決定します。,700万円～1020万円
株式会社日本レジストリサービス ,東京（神保町）と大阪（北新地）の同時募集です。 ★ゆくゆくは「大阪に戻りたい」という方大歓迎です！…,"月給26万1,750円〜35万5,125円 ※前職、経験、能力を最大限考慮し、支給額を決定致します。 ※試用期間は…",450万円～700万円
popIn株式会社 ,大阪府大阪市北区曽根崎新地1丁目13番地22 WeWork ◎転勤なし・UIターン歓迎！,月給35万円〜 ★想定年収500万円〜 ※待遇・条件については、年齢、経験、能力を考慮の上、 　社内規定…,初年度年収のデータなし
DiDiフードジャパン株式会社 ,【テレワーク実施中です】【転勤なし】 東京オフィス ／東京都中央区（Daiwa晴海WeWork 2…,月給18万円〜50万円 ※当社給与規程に準じて能力や適性、経験を考慮し決定します。 《入社1年目モデル…,400万円～700万円
NTTデータカスタマサービス株式会社 ,★全国各拠点 ★希望を考慮して決定！ ◇本社 ◎東京都江東区枝川1-9-4　住友不動産豊洲TKビル…,月給20万円〜45万円 【月収例】 月収32万円＝月給24.5万円+時間外手当4.2万円+住宅補助費3.3万円 ※経験…,430万円～650万円
UDS株式会社 ,◎転勤なし ◎原宿本社または、INBOUND LEAGUE（新宿） ★INBOUND LEAGUE…,年俸制350万円〜500万円 ※経験・能力を考慮の上、当社規定により優遇します。 ※上記には固定残業代と…,350万円～500万円
株式会社優誠 ,【なんばからアクセス良好！最寄り駅から徒歩3分の好立地】 ★2019年7月にオフィスを移転・拡大し…,"月給22万5,000円以上＋皆勤手当5,000円＋その他手当＋賞与 ※年齢・経験・スキルを十分考慮の上、当社規…",初年度年収のデータなし
アクセンチュア株式会社 ,【首都圏、関西を中心としたプロジェクト先】 ★リモート勤務あり プロジェクトによっても異なりますが…,初年度年俸420万円以上＋各種手当(残業手当など)＋業績賞与年1回 ※上記は入社初年度の最低保証年俸。年…,初年度年収のデータなし
株式会社ココロザシ ,《転居を伴う転勤なし》 ◆東京都内にあるプロジェクト先での勤務です ※感染症対策のため、リモートワ…,◆月給：30万円〜75万円 ※固定残業代（月20時間分／3万円〜）を含む。超過分は別途支給いたします。 《 …,400万円～1000万円
DiDiフードジャパン株式会社 ,★東京、大阪、福岡、広島、神戸、京都、名古屋、沖縄いずれかのエリアでの勤務となります。 【テレワー…,月給18万円〜50万円＋インセンティブ 《インセンティブについて》 毎月上長と加盟店獲得件数などの目標…,400万円～700万円
クリエイトソリューションズ株式会社 ,◆本社／埼玉県さいたま市大宮区高鼻町1-108-1 サクラファーストビル2Ｆ ◆東京23区のプロジ…,月給20万5004円以上 ※経験・保有技術を考慮の上、当社規定により優遇します 　また、「LPIC」有資格者は…,250万円～600万円
株式会社エフ・クルーズ ,本社 東京都千代田区一番町17-2 ラビ一番町4F [最寄り駅] 半蔵門駅 徒歩約3分 ※案件によ…,月給25万円〜55万円＋賞与（業績による） 【27歳・ITエンジニアの例】 前職時代：年収350万円 入社1年目…,350万円～700万円
ロシュリングエンジニアリングプラスティックス株式会社 ,★転勤なし★【新横浜より徒歩2分】 神奈川県横浜市港北区新横浜3-19-5 横浜第二センタービル8F,年俸制／300万円〜600万円 ※経験・スキルを考慮の上、当社規定により決定します ※別途出張手当あり ※…,300万円～600万円
株式会社C-mind ,【勤務地詳細】 東京都新宿区大久保2-5-23新宿辻ビル10階（総合受付5階） ※クライアント・お…,■月給：23万円〜70万円（経験・能力等考慮の上、規定により優遇） ※固定残業代：20時間分　3万5千円〜…,初年度年収のデータなし
パーソルテンプスタッフ株式会社 ,東京都、神奈川県、大阪府、京都府、兵庫県、愛知県の大手・優良企業 ★転居を伴う転勤はありません ★…,【東京】月給20万9700円以上＋賞与年2回 【神奈川】月給20万円以上＋賞与年2回 【大阪】月給19万7400円以…,250万円～350万円
グルーコードシステムズ株式会社 ,※転勤はありません※U・Iターン歓迎 【東京本社】東京都渋谷区渋谷3-10-19　渋谷MJ-2ビル…,月給30万円〜 ※当社給与規程に準じて能力や適性、経験を考慮し決定します。 ※試用期間3カ月（待遇変化…,300万円～1500万円
株式会社プラスアルファ・コンサルティング ,★週2日はリモートワーク運用！ 【本社】 東京都港区浜松町1-18-16 住友浜松町ビル6F,月給28万円以上 ＋ 諸手当 ＋ 賞与（年2回） ※経験・スキルを考慮の上、決定します。 ※上記には固定残…,420万円～700万円
株式会社アライブ．ｃｏｍ ,★転勤なし ★テレワークOK 【本社】 東京都港区芝大門2-9-8　シャンデールビル4F 【プロジ…,月給30万円〜 ＋残業代100％別途支給 ＋各種手当 ＋賞与2回 ※【前職の給与以上】を保証します。 ※経験…,450万円～850万円
株式会社優誠 ,【なんばからアクセス良好！最寄り駅から徒歩3分の好立地】 ★2019年7月にオフィスを移転・拡大し…,"月給23万5,000円〜35万円＋インセンティブ＋諸手当＋賞与 ※年齢・経験・スキルを考慮の上、当社規定に…",300万円～850万円
株式会社エルバークギア ,《転居をともなう転勤なし／UIターンも歓迎♪》 ■中目黒本社 東京都目黒区中目黒4-8-5 藤井ビ…,月給18万円〜 ★経験者は前職の給与額を保証（スキルチェンジを除く）★ ※スキルや年齢を考慮して決定…,初年度年収のデータなし
株式会社テクノソリューションズ ,【東京本社】 東京都新宿区西新宿6-6-3 新宿国際ビルディング新館4F アクセス： 都営地下鉄大…,月給26万円以上 ※経験・スキル・年齢を考慮の上、決定します。 ※試用期間3ヵ月（待遇の変更なし） ※…,初年度年収のデータなし
株式会社free mova,《現在リモートワーク&WEB面接を実施中※本社目黒駅徒歩30秒》 本社／東京都品川区上大崎2-15…,月給23万円〜30万円＋賞与2回＋昇給2回＋インセンティブ ※上記金額には、固定残業手当30時間分（4万2000…,400万円～600万円
オリジナル設計株式会社 ,【転勤なし／本社勤務】 東京都渋谷区元代々木町30−13 ONEST元代々木スクエア3F ＜交通ア…,"月給：22万9,000円〜41万6,000円＋賞与年2回＋各種手当 ※経験・年齢・能力を考慮のうえ、決定致します。",360万円～500万円
フォーザウィン株式会社 ,【転勤なし／希望を考慮】東京本社・渋谷支店・大阪支店・名古屋支店・群馬支店、または各プロジェクト先…,月給30万円〜 【前給以上を必ず保証します】 ※上記の金額に経験・能力等を考慮し加給します。 ※試用期…,400万円～1000万円
フォーザウィン株式会社 ,【転勤なし／希望を考慮】東京本社・渋谷支店・大阪支店・名古屋支店・群馬支店、または各プロジェクト先…,月給30万円〜 【前給以上を必ず保証します】 ※上記の金額に経験・能力等を考慮し加給します。 ※試用期…,450万円～1000万円
popIn株式会社 ,◆転勤なし ◆在宅勤務可能 東京都港区六本木6-10-1 六本木ヒルズ森タワー 39階 ★在宅勤務…,月給36.7万円〜51.4万円 ※待遇・条件については、年齢、経験、能力を考慮の上、社内規定に従って決定し…,500万円～700万円
株式会社ブール・ジャパン ,東京都、神奈川県、埼玉県の各プロジェクト先 ※勤務地は希望を考慮 ※転居を伴う転勤なし ※リモート…,月給20万円〜45万円+利益分配金+各種手当 ★テストエンジニア経験者は月給25万円以上 ※経験・能力・保…,240万円～580万円
株式会社ExPlay ,■仙台(仙台駅徒歩4分)or東京(六本木ヒルズ&在宅)勤務 ■転勤なし ■東京はリモートで仙台のマ…,"月給333,000円〜667,000円 ※経験やスキルを考慮し当社規定により優遇します。 ※試用期間3ヵ月間も同条…",400万円～800万円
株式会社SHIFT ,【東京本社】 東京都港区麻布台2-4-5 メソニック39MTビル ★本人の意志に沿わない転居を伴う…,"月給:28万3,334円〜33万3,334円 ※年齢・スキルなどを考慮のうえ、当社規定に基づき決定いたします ※試…",340万円～400万円
株式会社日立ソリューションズ・クリエイト ,★転勤なし ★品川シーサイド駅直結1分 東京都品川区東品川4丁目12番6号 品川シーサイドキャナル…,"月給225,000円以上 ＋ 賞与年2回 ※経験・能力を考慮のうえ、当社規程により決定します。 ※試用期間（3…",420万円～660万円
太栄コンサルタンツ株式会社 ,※転勤なし！ ※U・Iターンも歓迎！ 本社／名古屋市中区千代田3-26-18 ◎愛知県内および近隣…,月給20万円以上＋賞与年2回 ※あなたの転職が不利にならないよう、 　これまでの経験やスキルを考慮し、…,400万円～700万円
フォーザウィン株式会社 ,【転勤なし／希望を考慮】東京本社・渋谷支店・大阪支店・名古屋支店・群馬支店、または各プロジェクト先…,月給30万円〜 【前給以上を必ず保証します】 ※上記の金額に経験・能力等を考慮し加給します。 ※試用期…,400万円～1000万円
株式会社アイエム ,■希望を考慮し、本社またはクライアント先（首都圏）にて勤務 ★在宅ワークも導入しています ※本社／…,■月給30万円〜45万円＋残業代＋各種手当 ※経験・スキル・年齢を考慮の上、決定します。,400万円～600万円
株式会社ツリーベル ,【U・I・Ｊターン歓迎／転勤なし／プロジェクトの半数が自社内開発】 当社各拠点 もしくは首都圏、関…,★経験者であれば、月給35〜60万円！前給ももちろん考慮！ 【未経験者】 月給25〜35万円 ※上記には固定…,420万円～800万円
CBcloud株式会社 ,★転勤なし！ ★リモートワーク推進中！ ┗業務都合に合わせ、2日に1回ほどのペースで出社しています…,月給33万5000円〜 ※経験・スキル等を考慮の上決定します ※45時間分の固定残業代7万9762円含む(超過分は…,300万円～600万円
株式会社 ソリューション・アンド・テクノロジー ,【転勤なし／リモートワークを導入しています】 〈本社〉 東京都千代田区四番町６番　東急番町ビル８階…,月給28万4600円〜69万3000円＋賞与年2回 ※経験・能力を考慮し、決定します。,400万円～970万円
株式会社アンスール ,《東京 または 大阪 のいずれかのオフィス》 ※希望を考慮して配属します 〈東京本社〉 ■東京都中…,〈前給保証〉 月給30万円〜 ※経験やスキルを考慮して決定します ※固定残業代20時間(3万7500円〜)含む。…,初年度年収のデータなし
フォーザウィン株式会社 ,【転勤なし／希望を考慮】東京本社・渋谷支店・大阪支店・名古屋支店・群馬支店、または各プロジェクト先…,月給25万円〜 【前給以上を必ず保証します】 ※上記の金額に経験・能力等を考慮し加給します。 ※試用期…,400万円～1000万円
サングローブ株式会社 ,【早期入社できる方は優先選考！】転勤なし／東京（新宿）、大阪（梅田）◆勤務地を選べます★服装自由…,【1.営業経験者】 月給35万円〜 【2.Webインサイドセールス営業経験者】 月給52万円〜 【3.営業未経験…,350万円～1000万円
株式会社SHIFT ,東京・大阪の各拠点 ※本人の意志に沿わない転居を伴う転勤はなし ★全拠点最寄駅徒歩5分以内 ★U・…,"月給:33万3,334円~49万5,834円 (上記には固定残業代45時間分/8万6,800円~12万9,000円含みます。) 月給:50…",400万円～600万円
株式会社日立ソリューションズ・クリエイト ,★転勤なし ★品川シーサイド駅直結1分 東京都品川区東品川4丁目12番6号 品川シーサイドキャナル…,"月給225,000円以上 ＋ 賞与年2回 ※経験・能力を考慮のうえ、当社規程により決定します。 ※試用期間（3…",420万円～660万円
アベールソリューションズ株式会社 ,【本社】 東京都中央区銀座5丁目9−8　クロス銀座6F 【プロジェクト先】 東京都内のみ,"月給312,500円〜560,000円 ※35時間分（68,789円〜123,270円）の固定残業代含む。 ※超過分は別途支給。",500万円～896万円
パーソルテンプスタッフ株式会社 ,東京都、神奈川県、大阪府、京都府、兵庫県、愛知県の大手・優良企業 ★転居を伴う転勤はありません ★…,【東京】月給20万9700円以上＋賞与年2回 【神奈川】月給20万円以上＋賞与年2回 【大阪】月給19万7400円以…,250万円～350万円
株式会社リクルート ,◆仙台・宇都宮・大阪にて積極採用中！ 通いやすいオフィス環境！リモートワークなどにも対応中！ 【営…,月給26万2954円〜39万0887円 ※経験・年齢を考慮の上、当社規定により優遇します ※上記金額には月35時間…,420万円～625万円
株式会社3CA ,★転勤なし ★配属はお住まいや通勤も考慮して決定します。 首都圏（埼玉・千葉・東京・神奈川）の各プ…,年俸制／450万円〜800万円 【想定月収】37.5万円〜66.6万円 ※経験・能力・スキル等を考慮し、決定しま…,450万円～800万円
株式会社エー・エス・エル ,東京都、埼玉県、神奈川県、千葉県内のプロジェクト先 ※希望、お住まいを考慮の上、決定します。 ※転…,月給30万円〜　＋　賞与年3回 ※入社時点で、前職時の給与額を保証します！ ※経験・スキルなどを考慮の…,400万円～800万円
日本情報クリエイト株式会社 ,【 希望エリア配属／転勤なし 】 東京・名古屋・大阪・福岡・埼玉・札幌・仙台・金沢・広島のいずれか…,月給 20万円〜35万円（一律手当含む）＋ 賞与年2回 ※月間チームインセンティブあり （試用期間終了後、…,330万円～400万円
株式会社クレディセゾン ,＜本社・テクノロジーセンター＞ 東京都豊島区東池袋3-1-1 サンシャイン60内 ※以下にて勤務の…,"月給33万5,000円〜 ※経験・スキルに応じて決定いたします。",600万円～1000万円
株式会社 High mind ,【 クライアント先へはご自宅からの直行直帰 】 ★愛知県、岐阜県、三重県の東海エリア ※ご希望や居…,【 月給25万円〜50万円＋インセンティブ 】 経験・スキル・前職給与などを考慮の上、決定します。 固定…,350万円～800万円
株式会社クレディセゾン ,＜本社・テクノロジーセンター＞ 東京都豊島区東池袋3-1-1 サンシャイン60内 ※以下にて勤務の…,"月給33万5,000円〜 ※経験・スキルに応じて決定いたします。",600万円～1000万円
株式会社クレディセゾン ,＜本社・テクノロジーセンター＞ 東京都豊島区東池袋3-1-1 サンシャイン60内 ※以下にて勤務の…,"月給33万5,000円〜 ※経験・スキルに応じて決定いたします。",600万円～1000万円
株式会社アイエスエフネット ,【リモート案件多数】 ★69％が毎年昇給 ★MAX60％のインセンティブ賞与 ★UIターン歓迎(上…,【月給40万円~】＋インセンティブ賞与(月~20万/年~240万)・諸手当を別途支給 ★経験・スキルを考慮して…,480万円～1000万円
株式会社アイエスエフネット ,【リモート案件多数】 ★月~20万/年~240万のインセンティブ賞与 ★UIターン歓迎(上京時に寮…,<東京/埼玉/神奈川/千葉> (1)月給27万円~＋インセンティブ賞与・諸手当 <静岡/愛知/大阪> (2)月給26.5万…,306万円～1000万円
株式会社アイエスエフネット ,【リモート案件多数】 ★69％が毎年昇給 ★MAX60％のインセンティブ賞与 ★UIターン歓迎(上…,【月給35万円~】＋インセンティブ賞与(月~20万/年~240万)・諸手当 ▼設計構築5年以上の経験者 【月給40…,450万円～1000万円
NTTレゾナント・テクノロジー株式会社 ,★転勤なし ★東京・福岡募集 ★フルリモートワーク ■東京都千代田区神田神保町2-11-15住友商…,"月給250,000円〜＋残業代全額支給＋賞与年2回 ※前職給与、経験や能力を最大限考慮の上、決定いたします…",400万円～800万円
センコー株式会社 ,【在宅勤務も相談OK】希望に応じて京都本社（京都市伏見区）、東京オフィス（千代田区）に配属します。…,月給26万円〜100万円＋手当＋インセンティブ＋賞与 ★インセンティブは青天井 一人ひとりの成長度合いに…,500万円～1300万円
株式会社エージェントゲート ,首都圏（東京23区／丸の内・品川・東京・新宿・渋谷・六本木・秋葉原・池袋／横浜／大宮／千葉）などの…,経験3年以上の方／月給30万円〜 経験1年以上〜3年未満／月給25万円〜35万円 経験1年未満／月給23万円〜30…,300万円～1000万円
株式会社エージェントゲート ,首都圏（東京23区／丸の内・品川・東京・新宿・渋谷・六本木・秋葉原・池袋／横浜／大宮／千葉）などの…,経験3年以上の方／月給30万円〜 経験1年以上〜3年未満／月給25万円〜35万円 経験1年未満／月給23万円〜30…,300万円～1000万円
株式会社エージェントゲート ,首都圏（東京23区／丸の内・品川・東京・新宿・渋谷・六本木・秋葉原・池袋／横浜／大宮／千葉）などの…,経験3年以上の方／月給30万円〜 経験1年以上〜3年未満／月給25万円〜35万円 経験1年未満／月給23万円〜30…,300万円～1000万円
株式会社エージェントゲート ,首都圏（東京23区／丸の内・品川・東京・新宿・渋谷・六本木・秋葉原・池袋／横浜／大宮／千葉）などの…,経験3年以上の方／月給30万円〜 経験1年以上〜3年未満／月給25万円〜35万円 経験1年未満／月給23万円〜30…,300万円～1000万円
株式会社エージェントゲート ,首都圏（東京23区／丸の内・品川・東京・新宿・渋谷・六本木・秋葉原・池袋／横浜／大宮／千葉）などの…,経験3年以上の方／月給30万円〜 経験1年以上〜3年未満／月給25万円〜35万円 経験1年未満／月給23万円〜30…,300万円～1000万円
株式会社コンフィデンス ,＊---勤務地は希望を考慮して決定---＊ 【東京・神奈川・千葉・埼玉】を中心とした 各プロジェク…,【経験者】 月給:22万円〜70万円＋諸手当（残業代100％支給など）＋賞与年2回 【未経験】 月給:20万円以…,300万円～700万円
アデコ株式会社 ,★転勤なし ★首都圏または関西・東海エリア限定採用 各エリア内の大手・優良企業での勤務となります。…,月給23万9000円〜83万9000円 ＋ 残業代1分単位支給 ＋ 賞与（年2回） 【モデル月収例】 ・20代(構築経験…,350万円～1000万円
株式会社RUSHNetwork ,★転勤なし ★車通勤OK（駐車場完備） ★社用車を1人1台貸与 愛知県名古屋市中川区草平町1-8-…,◆月給25万〜40万円 ※経験・スキル等を考慮の上、当社規定により決定します。 ※試用期間は最大3ヶ月（…,300万円～400万円
株式会社日本ヒュウマップ ,【全国（沖縄を除く）各地で募集中】 ※基本直行直帰スタイル ※店舗等の詳細はHPをご参照ください。…,"月給21万700円〜28万8,700円（時間外手当別途支給） ※年齢により金額が変わります。 ※その他条件により…",300万円～450万円
株式会社ウィルオブ・ワーク ,《転勤なし！リモートワーク、在宅勤務もあり！》本社もしくは各プロジェクト先（1都3県） ※ご希望は…,"月給22万2,500円以上〜23万円＋賞与年2回 ※能力を考慮して最終的に決定します。 ※固定残業代（月20時間…",320万円～350万円
アルユーアイ株式会社 ,《★首都圏（神奈川、千葉、埼玉）のプロジェクトで積極採用！》 《★希望勤務地を考慮》 《★U・Iタ…,【インフラエンジニア経験者】 月給25万円〜50万円＋賞与（支給条件あり）＋各種手当 ※経験・スキル等を…,350万円～600万円
株式会社アクシス・クリエイト ,東京など首都圏(東京・神奈川・埼玉・千葉)、関西(大阪、兵庫、京都)のプロジェクト先 ※リモートワ…,<首都圏（東京本社所属）> 月給21万4000円以上 <関西（大阪支店所属）> 月給20万3000円以上 ※経験・能…,250万円～500万円
株式会社ウイングプラス ,首都圏の各プロジェクト先【東京・神奈川・埼玉・千葉】 ★転勤なし ★U・Iターン歓迎 【プロジェク…,月給:25万円〜60万円＋諸手当（残業代100％支給など）＋賞与年3回＋決算賞与（業績による） ※経験・年…,350万円～700万円
株式会社GSI ,★勤務地は東京・大阪・札幌・福岡・仙台が選べます！ ★新OPENの仙台は積極採用中 ★100％転勤…,〈月給〉 ◆経験者 東京：25万円〜＋賞与年2回 大阪：24万円〜＋賞与年2回 仙台：23万円〜＋賞与年2回 …,初年度年収のデータなし
SGビジネス株式会社 ,本社（横浜）または首都圏（東京・神奈川・千葉・埼玉）のプロジェクト先 ※勤務地は希望を考慮して決定…,月給:25万円〜45万円 ＋ 賞与年2回 ※経験・能力・スキル等を考慮の上、決定します。 ※固定残業代（40…,350万円～630万円
株式会社三鋭システム ,転勤なし！本社または首都圏を中心とする顧客先！ 本社／東京都千代田区外神田5-1-3　ニュー末広ビ…,月給21万5000円〜 ※未経験者の初任給、半年後に一度昇給あり。 ※上記金額には、時間外労働の有無に関わ…,250万円～550万円
株式会社divx ,★転勤なし ★自社オフィス（出社）&在宅勤務 ★フルリモート（応相談） 在宅勤務（リモートワーク）…,【月給】37万5000円〜（固定残業代含む） ※内定を出す場合は【前職の給与以上】を保証します。 ※固定残…,450万円～1002万円
株式会社SNSコーチ ,＊リモートワークで自由に働く！＊ 勤務スタイル リモートワークの働き方になります。責任は伴いますが…,月給:30万円〜＋インセンティブ＋賞与年１回 ※経験・スキルに応じて、当社規定により決定します。 ※残…,360万円～500万円
